{
    "error": "",
    "manufacturer_title": "Toyota",
    "active_models": {
        "heading": "Toyota New Car Models",
        "models": [
            {
                "title": "Toyota Corolla",
                "price": "PKR 13.3 - 95.0 lacs",
                "schema_price": 1330000.0,
                "review_rating": 3,
                "reviewCount": 296,
                "display_pic": {
                    "medium": "https://core.static1.pakkey.com/system/car_generation_pictures/5244/medium/_ffffff_-_Super_White.jpg?1761199891",
                    "original": "https://core.static1.pakkey.com/system/car_generation_pictures/5244/original/_ffffff_-_Super_White.jpg?1761199891",
                    "resized": "https://core.static1.pakkey.com/system/car_generation_pictures/5244/resized/_ffffff_-_Super_White.jpg?1761199891"
                },
                "link": "/new-cars/toyota/corolla/",
                "used_listing_link": "/used-cars/toyota-corolla/688",
                "used_listing_title": "Toyota Corolla for Sale in Pakistan",
                "used_listing_link_text": "Used Toyota Corolla for Sale"
            },
            {
                "title": "Toyota Hilux",
                "price": "PKR 21.44 - 43.99 lacs",
                "schema_price": 2144000.0,
                "review_rating": 3,
                "reviewCount": 10,
                "display_pic": {
                    "medium": "https://core.static1.pakkey.com/system/car_generation_pictures/4336/medium/Toyota_Hilux_Revo_2016-2017_%284%29.jpg?1481482790",
                    "original": "https://core.static1.pakkey.com/system/car_generation_pictures/4336/original/Toyota_Hilux_Revo_2016-2017_%284%29.jpg?1481482790",
                    "resized": "https://core.static1.pakkey.com/system/car_generation_pictures/4336/resized/Toyota_Hilux_Revo_2016-2017_%284%29.jpg?1481482790"
                },
                "link": "/new-cars/toyota/hilux/",
                "used_listing_link": "/used-cars/toyota-hilux/789",
                "used_listing_title": "Toyota Hilux for Sale in Pakistan",
                "used_listing_link_text": "Used Toyota Hilux for Sale"
            },
            {
                "title": "Toyota Avanzaa",
                "price": "PKR 29.99 lacs",
                "schema_price": 2999000.0,
                "review_rating": 3,
                "reviewCount": 5,
                "display_pic": {
                    "medium": "https://core.wsa3.pakkey.com/assets/default-display-image-car-6873f23250596c4daa082e7223e5bbb5d1fbcaf7bb5d7113003daa9ebd3c66a8.png",
                    "original": "https://core.wsa3.pakkey.com/assets/default-display-image-car-6873f23250596c4daa082e7223e5bbb5d1fbcaf7bb5d7113003daa9ebd3c66a8.png",
                    "resized": "https://core.wsa3.pakkey.com/assets/default-display-image-car-6873f23250596c4daa082e7223e5bbb5d1fbcaf7bb5d7113003daa9ebd3c66a8.png"
                },
                "link": "/new-cars/toyota/avanza/",
                "used_listing_link": "/used-cars/toyota-avanza/834",
                "used_listing_title": "Toyota Avanzaa for Sale in Pakistan",
                "used_listing_link_text": "Used Toyota Avanzaa for Sale"
            },
            {
                "title": "Toyota Hiace",
                "price": "PKR 34.29 - 63.49 lacs",
                "schema_price": 3429000.0,
                "review_rating": 3,
                "reviewCount": 1,
                "display_pic": {
                    "medium": "https://core.static1.pakkey.com/system/car_generation_pictures/2378/medium/1.jpg?1433246120",
                    "original": "https://core.static1.pakkey.com/system/car_generation_pictures/2378/original/1.jpg?1433246120",
                    "resized": "https://core.static1.pakkey.com/system/car_generation_pictures/2378/resized/1.jpg?1433246120"
                },
                "link": "/new-cars/toyota/hiace/",
                "used_listing_link": "/used-cars/toyota-hiace/769",
                "used_listing_title": "Toyota Hiace for Sale in Pakistan",
                "used_listing_link_text": "Used Toyota Hiace for Sale"
            },
            {
                "title": "Toyota Fortuner",
                "price": "PKR 63.99 - 195.69 lacs",
                "schema_price": 6399000.0,
                "review_rating": 3,
                "reviewCount": 5,
                "display_pic": {
                    "medium": "https://core.static2.pakkey.com/system/car_generation_pictures/4406/medium/Toyota_Fortuner_2017_%282%29.jpg?1484662012",
                    "original": "https://core.static2.pakkey.com/system/car_generation_pictures/4406/original/Toyota_Fortuner_2017_%282%29.jpg?1484662012",
                    "resized": "https://core.static2.pakkey.com/system/car_generation_pictures/4406/resized/Toyota_Fortuner_2017_%282%29.jpg?1484662012"
                },
                "link": "/new-cars/toyota/fortuner/",
                "used_listing_link": "/used-cars/toyota-fortuner/833",
                "used_listing_title": "Toyota Fortuner for Sale in Pakistan",
                "used_listing_link_text": "Used Toyota Fortuner for Sale"
            },
            {
                "title": "Toyota Corolla Cross",
                "price": "PKR 88.99 lacs",
                "schema_price": 8899000.0,
                "review_rating": 4,
                "reviewCount": 1,
                "display_pic": {
                    "medium": "https://core.static2.pakkey.com/system/car_generation_pictures/4883/medium/Cross_exterior.jpg?1716795998",
                    "original": "https://core.static2.pakkey.com/system/car_generation_pictures/4883/original/Cross_exterior.jpg?1716795998",
                    "resized": "https://core.static2.pakkey.com/system/car_generation_pictures/4883/resized/Cross_exterior.jpg?1716795998"
                },
                "link": "/new-cars/toyota/corolla-cross/",
                "used_listing_link": "/used-cars/search/-/mk_toyota/md_corolla-cross/",
                "used_listing_title": "Toyota Corolla Cross for Sale in Pakistan",
                "used_listing_link_text": "Used Toyota Corolla Cross for Sale"
            },
            {
                "title": "Toyota Prado",
                "price": "PKR 139.49 - 194.99 lacs",
                "schema_price": 13949000.0,
                "review_rating": 3,
                "reviewCount": 1,
                "display_pic": {
                    "medium": "https://core.wsa3.pakkey.com/assets/default-display-image-car-6873f23250596c4daa082e7223e5bbb5d1fbcaf7bb5d7113003daa9ebd3c66a8.png",
                    "original": "https://core.wsa3.pakkey.com/assets/default-display-image-car-6873f23250596c4daa082e7223e5bbb5d1fbcaf7bb5d7113003daa9ebd3c66a8.png",
                    "resized": "https://core.wsa3.pakkey.com/assets/default-display-image-car-6873f23250596c4daa082e7223e5bbb5d1fbcaf7bb5d7113003daa9ebd3c66a8.png"
                },
                "link": "/new-cars/toyota/prado/",
                "used_listing_link": "/used-cars/toyota-prado/38678",
                "used_listing_title": "Toyota Prado for Sale in Pakistan",
                "used_listing_link_text": "Used Toyota Prado for Sale"
            },
            {
                "title": "Toyota Land Cruiser",
                "price": "PKR 206.99 - 241.0 lacs",
                "schema_price": 20699000.0,
                "review_rating": 3,
                "reviewCount": 6,
                "display_pic": {
                    "medium": "https://core.static2.pakkey.com/system/car_generation_pictures/3022/medium/Toyota-Land-Cruiser_2015.jpg?1444118953",
                    "original": "https://core.static2.pakkey.com/system/car_generation_pictures/3022/original/Toyota-Land-Cruiser_2015.jpg?1444118953",
                    "resized": "https://core.static2.pakkey.com/system/car_generation_pictures/3022/resized/Toyota-Land-Cruiser_2015.jpg?1444118953"
                },
                "link": "/new-cars/toyota/land-cruiser/",
                "used_listing_link": "/used-cars/toyota-land-cruiser/651",
                "used_listing_title": "Toyota Land Cruiser for Sale in Pakistan",
                "used_listing_link_text": "Used Toyota Land Cruiser for Sale"
            },
            {
                "title": "Toyota Camry",
                "price": "PKR 538.59 lacs",
                "schema_price": 53859000.0,
                "review_rating": 3,
                "reviewCount": 7,
                "display_pic": {
                    "medium": "https://core.static1.pakkey.com/system/car_generation_pictures/4722/medium/Toyota_Camry_.jpg?1509949569",
                    "original": "https://core.static1.pakkey.com/system/car_generation_pictures/4722/original/Toyota_Camry_.jpg?1509949569",
                    "resized": "https://core.static1.pakkey.com/system/car_generation_pictures/4722/resized/Toyota_Camry_.jpg?1509949569"
                },
                "link": "/new-cars/toyota/camry/",
                "used_listing_link": "/used-cars/toyota-camry/648",
                "used_listing_title": "Toyota Camry for Sale in Pakistan",
                "used_listing_link_text": "Used Toyota Camry for Sale"
            }
        ]
    },
    "imported_models": [],
    "discontinued_models": [],
    "upcoming_models": null,
    "heading": "Toyota Cars in Pakistan",
        "description": "<p>The prices of a Toyota Car in Pakistan start from PKR 1,330,000.0 for a new Toyota Corolla to PKR 53,859,000.0 for a new Toyota Camry. There are currently 9 new car models available at <a href=\"/new-cars/dealers/toyota/223928\">Toyota</a> dealerships across Pakistan.</p><p>Toyota Cars are also widely available in used conditions starting from PKR 13,464 for a used Toyota Land Cruiser to PKR 950,000,000 for a used Toyota Corolla. There are a total of 5897 Toyota Cars available for sale in Pakistan on PakWheels.</p>",